Entrez ID	Gene Symbol	Gene Name	Refseq mRNA	Refseq Protein	Ensembl Gene ID	UCSC Genomic Coordinates	GO Categories	Sources
2261	FGFR3	fibroblast growth factor receptor 3 (achondroplasia, thanatophoric dwarfism)	NM_022965, NM_000142	NP_075254.1, NP_000133.1	ENSG00000068078	chr4:1765459 - 1778787	ATP binding;cell growth;fibroblast growth factor receptor activity;fibroblast growth factor receptor signaling pathway;identical protein binding;integral to plasma membrane;JAK-STAT cascade;MAPKKK cascade;membrane;nucleotide binding;protein amino acid phosphorylation;protein-tyrosine kinase activity;receptor activity;skeletal development;transferase activity	Futreal et al 2004,  Mitelman 2000,  Vogelstein and Kinzler 2004,  Tyrosine Kinase,  Missense mutation,  Translocation
2271	FH	fumarate hydratase	NM_000143	NP_000134.2	ENSG00000091483	chr1:239727750 - 239749645	cell cycle;cytoplasm;fumarate hydratase activity;fumarate metabolic process;lyase activity;mitochondrion;negative regulation of progression through cell cycle;tricarboxylic acid cycle;tricarboxylic acid cycle enzyme complex	Futreal et al 2004,  Vogelstein and Kinzler 2004,  Tumor Suppressor,  Frameshift mutation,  Missense mutation,  Nonsense mutation
81608	FIP1L1	FIP1 like 1 (S. cerevisiae)	NM_030917	NP_112179.2	ENSG00000145216	chr4:54004988 - 54020452	mRNA processing;nucleus;RNA binding	Futreal et al 2004,  Mitelman 2000,  Translocation
201163	FLCN	folliculin	NM_144606, NM_144997	NP_653207.1, NP_659434.2	ENSG00000154803	chr17:17057693 - 17072176	cell cycle;negative regulation of progression through cell cycle	Futreal et al 2004,  Vogelstein and Kinzler 2004,  Tumor Suppressor,  Frameshift mutation,  Missense mutation,  Nonsense mutation
2313	FLI1	Friend leukemia virus integration 1	NM_002017	NP_002008.2	ENSG00000151702	chr11:128069363 - 128186093	circulation;hemostasis;nucleus;organ morphogenesis;regulation of transcription, DNA-dependent;sequence-specific DNA binding;transcription;transcription factor activity	Futreal et al 2004,  Mitelman 2000,  Tumor Suppressor,  Entrez Query:Oncogene,  Translocation
2322	FLT3	fms-related tyrosine kinase 3	NM_004119	NP_004110.2	ENSG00000122025	chr13:27476188 - 27572647	ATP binding;integral to plasma membrane;lymphocyte differentiation;membrane;nucleotide binding;positive regulation of cell proliferation;protein amino acid phosphorylation;protein binding;receptor activity;transferase activity;transmembrane receptor protein tyrosine kinase signaling pathway;vascular endothelial growth factor receptor activity	Futreal et al 2004,  Vogelstein and Kinzler 2004,  Protein Kinase,  Tumor Suppressor,  Tyrosine Kinase,  Missense mutation
2324	FLT4	fms-related tyrosine kinase 4	NM_182925, NM_002020	NP_891555.2, NP_002011.2	ENSG00000037280	chr5:179962797 - 180009151	ATP binding;integral to plasma membrane;membrane;nucleotide binding;protein amino acid phosphorylation;protein binding;protein-tyrosine kinase activity;receptor activity;transferase activity;transmembrane receptor protein tyrosine kinase signaling pathway;vascular endothelial growth factor receptor activity	Futreal et al 2004,  Vogelstein and Kinzler 2004,  Protein Kinase,  Tyrosine Kinase,  Missense mutation
23048	FNBP1	formin binding protein 1	NM_015033	NP_055848.1	ENSG00000187239	chr9:131692638 - 131845075	cytoskeleton;endocytosis;identical protein binding;intracellular;lipid binding;lysosome;membrane;ribosome;RNA binding;structural constituent of ribosome;translation	Futreal et al 2004,  Mitelman 2000,  Translocation
2308	FOXO1	forkhead box O1	NM_002015	NP_002006.2	ENSG00000150907	chr13:40031659 - 40138349	anti-apoptosis;blood vessel development;cytoplasm;insulin receptor signaling pathway;nucleus;positive regulation of transcription from RNA polymerase II promoter;protein binding;regulation of cell proliferation;regulation of transcription, DNA-dependent;sequence-specific DNA binding;transcription;transcription factor activity;transcriptional activator activity	EGFR1,  TGFBR,  Futreal et al 2004,  Mitelman 2000,  Vogelstein and Kinzler 2004,  Stability,  Tumor Suppressor,  Translocation
2309	FOXO3	forkhead box O3	NM_201559	NP_963853.1	ENSG00000118689	chr6:108989104 - 109092751	antral ovarian follicle growth;apoptosis;cytoplasm;glucose homeostasis;induction of apoptosis;initiation of primordial ovarian follicle growth;membrane fraction;nucleus;oocyte maturation;ovulation (sensu Mammalia);positive regulation of erythrocyte differentiation;positive regulation of transcription from RNA polymerase II promoter;protein kinase binding;regulation of transcription, DNA-dependent;response to DNA damage stimulus;sequence-specific DNA binding;transcription;transcription factor activity;transc	Futreal et al 2004,  Mitelman 2000,  Vogelstein and Kinzler 2004,  Tumor Suppressor,  Translocation
4303	FOXO4	forkhead box O4	NM_005938	NP_005929.2	ENSG00000184481	chrX:70233103 - 70238659	cell cycle;cell cycle arrest;cell differentiation;cytosol;enzyme binding;G1 phase of mitotic cell cycle;insulin receptor signaling pathway;multicellular organismal development;negative regulation of angiogenesis;negative regulation of cell proliferation;negative regulation of smooth muscle cell differentiation;nucleus;regulation of transcription, DNA-dependent;sequence-specific DNA binding;striated muscle development;transcription;transcription factor activity;transcription factor binding;transcription from	TGFBR,  Futreal et al 2004,  Mitelman 2000,  Stability,  Translocation
10272	FSTL3	follistatin-like 3 (secreted glycoprotein)	NM_005860	NP_005851.1	ENSG00000070404	chr19:627423 - 632708	activin binding;activin inhibitor activity;extracellular space;negative regulation of BMP signaling pathway	Futreal et al 2004,  Mitelman 2000,  Translocation
2521	FUS	fusion (involved in t(12;16) in malignant liposarcoma)	NM_004960	NP_004951.1	ENSG00000089280	chr16:31099036 - 31110260	biological_process;cellular_component;DNA binding;intracellular;metal ion binding;molecular_function;nucleic acid binding;nucleotide binding;nucleus;protein binding;RNA binding;zinc ion binding	Futreal et al 2004,  Mitelman 2000,  Entrez Query:Oncogene,  Translocation
8522	GAS7	growth arrest-specific 7	NM_201432, NM_003644, NM_201433	NP_958836.1, NP_003635.2, NP_958839.1	ENSG00000007237	chr17:9761269 - 10042432	actin filament;actin filament binding;actin filament bundle formation;actin filament polymerization;cell cycle arrest;cell differentiation;endocytosis;multicellular organismal development;nervous system development;regulation of cell shape;ruffle;transcription factor activity	Futreal et al 2004,  Mitelman 2000,  Translocation
2623	GATA1	GATA binding protein 1 (globin transcription factor 1)	NM_002049	NP_002040.1	ENSG00000102145	chrX:48534460 - 48537515	metal ion binding;multicellular organismal development;nucleus;regulation of transcription from RNA polymerase II promoter;sequence-specific DNA binding;transcription;transcription factor activity;zinc ion binding	NOTCH,  Futreal et al 2004,  Frameshift mutation,  Missense mutation
8833	GMPS	guanine monphosphate synthetase	NM_003875	NP_003866.1	ENSG00000163655	chr3:157071353 - 157138175	ATP binding;biosynthetic process;glutamine metabolic process;GMP biosynthetic process;GMP synthase (glutamine-hydrolyzing) activity;GMP synthase activity;ligase activity;nucleotide binding;purine base biosynthetic process;purine nucleotide biosynthetic process	Futreal et al 2004,  Mitelman 2000,  Translocation
2778	GNAS	GNAS complex locus	NM_080426, NM_001077489, NM_001077488, NM_000516, NM_080425, NM_016592	NP_536351.1, NP_001070957.1, NP_001070956.1, NP_000507.1, NP_536350.2, NP_057676.1	ENSG00000087460	chr20:56861715 - 56919279	adenylate cyclase activation;cytoplasm;extracellular region;G-protein coupled receptor protein signaling pathway;G-protein signaling, adenylate cyclase activating pathway;Golgi to secretory vesicle transport;Golgi trans cisterna;GTP binding;GTPase activity;guanyl nucleotide binding;heterotrimeric G-protein complex;membrane;molecular_function;nucleotide binding;plasma membrane;pregnancy;protein binding;protein secretion;protein targeting;sensory perception of smell;signal transducer activity;signal transduct	Futreal et al 2004,  Missense mutation
9950	GOLGA5	golgi autoantigen, golgin subfamily a, 5	NM_005113	NP_005104.2	ENSG00000066455	chr14:92333535 - 92375544	ATP binding;cell surface receptor linked signal transduction;cis-Golgi network;Golgi apparatus;Golgi cisterna;Golgi organization and biogenesis;Golgi vesicle transport;integral to membrane;membrane;protein amino acid phosphorylation;protein homodimerization activity;protein-tyrosine kinase activity;Rab GTPase binding	Futreal et al 2004,  Mitelman 2000,  Protein Kinase,  Entrez Query:Oncogene,  Translocation
57120	GOPC	golgi associated PDZ and coiled-coil motif containing			ENSG00000047932	chr6:null	apical protein localization;cystic fibrosis transmembrane conductance regulator binding;cytoplasm;cytoplasmic sequestering of CFTR protein;ER to Golgi vesicle-mediated transport;Golgi apparatus;Golgi to plasma membrane transport;intracellular transporter activity;membrane fraction;plasma membrane;protein homooligomerization;protein transport;syntaxin-6 binding;trans-Golgi network transport vesicle	Futreal et al 2004,  Mitelman 2000,  Entrez Query:Oncogene
5413	GP1BB	septin 5	NM_002688, NM_000407	NP_002679.2, NP_000398.1	ENSG00000184702	chr22:18091092 - 18091987	cell cycle;cytokinesis;GTP binding;GTPase activity;nucleotide binding;plasma membrane;protein binding;regulation of exocytosis;structural molecule activity;synaptic vesicle;synaptic vesicle targeting	Futreal et al 2004,  Mitelman 2000,  Translocation
2719	GPC3	glypican 3	NM_004484	NP_004475.1	ENSG00000147257	chrX:132497817 - 132947142	GPI anchor binding;integral to plasma membrane;membrane;negative regulation of cell proliferation;negative regulation of growth;organ morphogenesis;positive regulation of BMP signaling pathway;proteinaceous extracellular matrix;ureteric bud branching	Futreal et al 2004,  Vogelstein and Kinzler 2004,  Tumor Suppressor,  Frameshift mutation,  Large deletion,  Missense mutation,  Nonsense mutation,  Splicing mutation,  Translocation
10243	GPHN	gephyrin	NM_020806, NM_001024218	NP_065857.1, NP_001019389.1	ENSG00000171723	chr14:66044998 - 66717407	catalytic activity;cytoskeleton;establishment of synaptic specificity at neuromuscular junction;magnesium ion binding;Mo-molybdopterin cofactor biosynthetic process;nucleotide binding	Futreal et al 2004,  Mitelman 2000,  Translocation
3092	HIP1	huntingtin interacting protein 1	NM_005338	NP_005329.3	ENSG00000127946	chr7:75005428 - 75206174	actin binding;caspase activation;clathrin binding;clathrin cage assembly;cytoplasm;cytoskeleton;endocytosis;Golgi apparatus;membrane fraction;phospholipid binding;regulation of apoptosis;structural constituent of cytoskeleton	EGFR1,  Futreal et al 2004,  Mitelman 2000,  Translocation
8294	HIST1H4I	histone cluster 1, H4i			ENSG00000197238	chr6:null		Futreal et al 2004,  Mitelman 2000,  Translocation
3131	HLF	hepatic leukemia factor	NM_002126	NP_002117.1	ENSG00000108924	chr17:50697844 - 50753239	double-stranded DNA binding;multicellular organismal development;nucleus;protein dimerization activity;regulation of transcription, DNA-dependent;rhythmic process;sequence-specific DNA binding;transcription;transcription factor activity;transcription from RNA polymerase II promoter	Futreal et al 2004,  Mitelman 2000,  Translocation
3159	HMGA1	high mobility group AT-hook 1	NM_145905	NP_665912.1	ENSG00000137309	chr6:34316535 - 34320639	AT DNA binding;chromatin;chromosome;chromosome organization and biogenesis (sensu Eukaryota);DNA binding;DNA unwinding during replication;ligand-dependent nuclear receptor transcription coactivator activity;loss of chromatin silencing;nucleosome disassembly;nucleus;peroxisome proliferator activated receptor binding;positive regulation of transcription;protein complex assembly;regulation of transcription, DNA-dependent;retinoid X receptor binding;transcription;transcription factor activity;transcription fact	Futreal et al 2004,  Mitelman 2000,  Entrez Query:Oncogene,  Translocation
8091	HMGA2	high mobility group AT-hook 2	NM_003483, NM_003484	NP_003474.1, NP_003475.1	ENSG00000149948	chr12:64505317 - 64643339	AT DNA binding;chromatin;chromosome;chromosome organization and biogenesis (sensu Eukaryota);DNA binding;establishment and/or maintenance of chromatin architecture;multicellular organismal development;nucleus;protein binding;regulation of transcription, DNA-dependent;transcription	Futreal et al 2004,  Mitelman 2000,  Vogelstein and Kinzler 2004,  Entrez Query:Oncogene,  Translocation
6927	HNF1A	transcription factor 1, hepatic; LF-B1, hepatic nuclear factor (HNF1), albumin proximal factor	NM_000545	NP_000536.4	ENSG00000135100	chr12:119900954 - 119923378	glucose homeostasis;nucleus;positive regulation of transcription;protein binding;regulation of transcription from RNA polymerase II promoter;RNA polymerase II transcription factor activity;sequence-specific DNA binding;transcription factor activity;transcriptional activator activity	Futreal et al 2004,  Stability,  Frameshift mutation,  Missense mutation
3207	HOXA11	homeobox A11	NM_005523	NP_005514.1	ENSG00000005073	chr7:27188939 - 27191288	anatomical structure morphogenesis;induction of an organ;metanephros development;multicellular organismal development;nucleus;protein binding;regulation of transcription, DNA-dependent;sequence-specific DNA binding;skeletal development;transcription factor activity	Futreal et al 2004,  Mitelman 2000,  Vogelstein and Kinzler 2004,  Translocation
3209	HOXA13	homeobox A13	NM_000522	NP_000513.2	ENSG00000106031	chr7:27204341 - 27206221	multicellular organismal development;nucleus;protein binding;regulation of transcription, DNA-dependent;sequence-specific DNA binding;skeletal development;transcription factor activity	Futreal et al 2004,  Mitelman 2000,  Vogelstein and Kinzler 2004,  Translocation
3205	HOXA9	homeobox A9	NM_152739	NP_689952.1	ENSG00000078399	chr7:27169746 - 27171601	biological_process;molecular_function;multicellular organismal development;nucleus;protein binding;regulation of transcription, DNA-dependent;sequence-specific DNA binding;transcription factor activity;transcriptional activator activity	TGFBR,  Futreal et al 2004,  Mitelman 2000,  Vogelstein and Kinzler 2004,  Translocation
3227	HOXC11	homeobox C11	NM_014212	NP_055027.1	ENSG00000123388	chr12:52653292 - 52655464	endoderm development;induction of an organ;metanephros development;multicellular organismal development;nucleus;regulation of transcription, DNA-dependent;RNA polymerase II transcription factor activity;sequence-specific DNA binding;transcription factor activity	Futreal et al 2004,  Mitelman 2000,  Translocation
3229	HOXC13	homeobox C13	NM_017410	NP_059106.2	ENSG00000123364	chr12:52618957 - 52625307	anatomical structure morphogenesis;multicellular organismal development;nucleus;regulation of transcription, DNA-dependent;RNA polymerase II transcription factor activity;sequence-specific DNA binding;transcription factor activity	Futreal et al 2004,  Mitelman 2000,  Vogelstein and Kinzler 2004,  Translocation
3237	HOXD11	homeobox D11	NM_021192	NP_067015.2	ENSG00000128713	chr2:176680329 - 176682116	induction of an organ;metanephros development;multicellular organismal development;nucleus;regulation of transcription, DNA-dependent;sequence-specific DNA binding;skeletal development;transcription factor activity	Futreal et al 2004,  Mitelman 2000,  Vogelstein and Kinzler 2004,  Translocation
3239	HOXD13	homeobox D13	NM_000523	NP_000514.2	ENSG00000128714	chr2:176665864 - 176667704	embryonic limb morphogenesis;nucleus;pattern specification process;regulation of cell proliferation;regulation of transcription, DNA-dependent;sequence-specific DNA binding;skeletal development;transcription factor activity;transcription from RNA polymerase II promoter	Futreal et al 2004,  Mitelman 2000,  Vogelstein and Kinzler 2004,  Translocation
3265	HRAS	v-Ha-ras Harvey rat sarcoma viral oncogene homolog	NM_176795, NM_005343	NP_789765.1, NP_005334.1	ENSG00000174775	chr11:522635 - 524322	cell surface receptor linked signal transduction;chemotaxis;cytoplasm;GTP binding;intracellular;membrane;nucleotide binding;organ morphogenesis;plasma membrane;protein C-terminus binding;regulation of progression through cell cycle;small GTPase mediated signal transduction	EGFR1,  Kit Receptor,  Futreal et al 2004,  Hahn and Weinberg 2002,  Tumor Suppressor,  Entrez Query:Oncogene,  Missense mutation
3320	HSP90AA1	heat shock protein 90kDa alpha (cytosolic), class A member 1	NM_001017963	NP_005339.3	ENSG00000080824	chr14:101617801 - 101675494	ATP binding;biological_process;cellular_component;cytosol;mitochondrial transport;molecular_function;nitric-oxide synthase regulator activity;nucleotide binding;positive regulation of nitric oxide biosynthetic process;protein folding;protein homodimerization activity;protein refolding;response to unfolded protein;signal transduction;TPR domain binding;unfolded protein binding	TNF_alpha_NF_kB,  Futreal et al 2004,  Stability,  Entrez Query:Oncogene,  Translocation
3326	HSP90AB1	heat shock protein 90kDa alpha (cytosolic), class B member 1	NM_007355	NP_031381.2	ENSG00000096384	chr6:44324344 - 44329313	ATP binding;cellular_component;cytoplasm;mitochondrion;nitric-oxide synthase regulator activity;nucleotide binding;positive regulation of nitric oxide biosynthetic process;protein folding;response to unfolded protein;TPR domain binding;unfolded protein binding	TNF_alpha_NF_kB,  Futreal et al 2004,  Translocation
10320	IKZF1	IKAROS family zinc finger 1 (Ikaros)	NM_006060	NP_006051.1	ENSG00000185811	chr7:50329202 - 50435819	DNA binding;intracellular;mesoderm development;metal ion binding;nucleus;regulation of transcription, DNA-dependent;transcription;zinc ion binding	Futreal et al 2004,  Mitelman 2000,  Translocation
3558	IL2	interleukin 2	NM_000586	NP_000577.2	ENSG00000109471	chr4:123592356 - 123597045	anti-apoptosis;cell adhesion;cell-cell signaling;cytokine activity;extracellular region;extracellular space;immune response;interleukin-2 receptor binding;kinase activator activity;natural killer cell activation;positive regulation of cell growth;positive regulation of cell proliferation;T cell differentiation	Futreal et al 2004,  Mitelman 2000,  Protein Kinase,  Stability,  Tumor Suppressor,  Translocation
50615	IL21R	interleukin 21 receptor	NM_181078	NP_851565.1	ENSG00000103522	chr16:27348893 - 27368105	integral to membrane;interleukin-21 receptor activity;membrane;natural killer cell activation;receptor activity	Futreal et al 2004,  Mitelman 2000,  Translocation
3662	IRF4	interferon regulatory factor 4	NM_002460	NP_002451.2	ENSG00000137265	chr6:338152 - 352598	intracellular;nucleus;positive regulation of interleukin-10 biosynthetic process;positive regulation of interleukin-13 biosynthetic process;positive regulation of interleukin-2 biosynthetic process;positive regulation of interleukin-4 biosynthetic process;positive regulation of transcription;regulation of T-helper cell differentiation;regulation of transcription, DNA-dependent;RNA polymerase II transcription factor activity;T cell activation;transcription;transcription factor activity;transcription factor b	Futreal et al 2004,  Mitelman 2000,  Entrez Query:Oncogene,  Translocation
3717	JAK2	Janus kinase 2 (a protein tyrosine kinase)	NM_004972	NP_004963.1	ENSG00000096968	chr9:5011987 - 5116791	apoptosis;ATP binding;cell motility;cytoskeleton;intracellular signaling cascade;Janus kinase activity;mesoderm development;myeloid cell differentiation;negative regulation of cell proliferation;nucleotide binding;protein amino acid phosphorylation;protein-tyrosine kinase activity;receptor binding;regulation of progression through cell cycle;SH2 domain binding;STAT protein nuclear translocation;transferase activity;tyrosine phosphorylation of STAT protein	EGFR1,  Kit Receptor,  NOTCH,  Futreal et al 2004,  Mitelman 2000,  Vogelstein and Kinzler 2004,  Protein Kinase,  Stability,  Tumor Suppressor,  Tyrosine Kinase,  Translocation
221895	JAZF1	JAZF zinc finger 1	NM_175061	NP_778231.2	ENSG00000153814	chr7:27838943 - 28186721	intracellular;metal ion binding;negative regulation of transcription from RNA polymerase II promoter;nucleic acid binding;nucleus;regulation of transcription, DNA-dependent;transcription;transcription corepressor activity;transcriptional repressor complex;zinc ion binding	Futreal et al 2004,  Mitelman 2000,  Translocation
2531	KDSR	follicular lymphoma variant translocation 1	NM_002035	NP_002026.1	ENSG00000119537	chr18:59149994 - 59185331	3-dehydrosphinganine reductase activity;endoplasmic reticulum;extracellular space;integral to membrane;membrane;metabolic process;oxidoreductase activity	Futreal et al 2004,  Mitelman 2000,  Translocation
57714	KIAA1618	KIAA1618	NM_020954	NP_066005.2	ENSG00000180843	chr17:75876754 - 75924899	oxidoreductase activity;transition metal ion binding	Futreal et al 2004,  Mitelman 2000,  Translocation
3815	KIT	v-kit Hardy-Zuckerman 4 feline sarcoma viral oncogene homolog	NM_000222, NM_001093772	NP_000213.1, NP_001087241.1	ENSG00000157404	chr4:55218938 - 55299480	ATP binding;cytokine and chemokine mediated signaling pathway;external side of plasma membrane;hemopoiesis;integral to membrane;membrane;nucleotide binding;peptidyl-tyrosine phosphorylation;pigmentation during development;protein amino acid dephosphorylation;protein binding;protein kinase cascade;receptor activity;receptor signaling protein tyrosine kinase activity;response to radiation;signal transduction;stem cell factor receptor activity;transferase activity;transmembrane receptor protein tyrosine kinase	Kit Receptor,  Futreal et al 2004,  Vogelstein and Kinzler 2004,  Protein Kinase,  Tumor Suppressor,  Tyrosine Kinase,  Entrez Query:Oncogene,  Missense mutation
1316	KLF6	Kruppel-like factor 6	NM_001300	NP_001291.3	ENSG00000067082	chr10:3811730 - 3817206	B cell differentiation;biological_process;cell growth;cellular_component;DNA binding;intracellular;metal ion binding;molecular_function;nucleic acid binding;nucleus;regulation of transcription, DNA-dependent;transcription;transcriptional activator activity;zinc ion binding	Futreal et al 2004,  Stability,  Tumor Suppressor,  Entrez Query:Oncogene,  Missense mutation,  Nonsense mutation
3845	KRAS	v-Ki-ras2 Kirsten rat sarcoma viral oncogene homolog	NM_004985, NM_033360	NP_004976.2, NP_203524.1	ENSG00000133703	chr12:25259641 - 25289585	GTP binding;GTPase activity;intracellular;membrane;nucleotide binding;protein binding;regulation of progression through cell cycle;sensory perception of sound;small GTPase mediated signal transduction	EGFR1,  Futreal et al 2004,  Vogelstein and Kinzler 2004,  Tumor Suppressor,  Entrez Query:Oncogene,  Missense mutation
3895	KTN1	kinectin 1 (kinesin receptor)	NM_001079522, NM_182926, NM_004986	NP_001072990.1, NP_891556.1, NP_004977.2	ENSG00000126777	chr14:55148519 - 55220574	endoplasmic reticulum;endoplasmic reticulum membrane;integral to plasma membrane;membrane;membrane fraction;microtubule-based movement;molecular_function;receptor activity	TNF_alpha_NF_kB,  Futreal et al 2004,  Mitelman 2000,  Translocation
3927	LASP1	LIM and SH3 protein 1	NM_006148	NP_006139.1	ENSG00000002834	chr17:34324113 - 34328651	actin binding;cortical actin cytoskeleton;cortical cytoskeleton organization and biogenesis;cytoskeleton;ion transport;ion transporter activity;metal ion binding;SH3/SH2 adaptor activity;zinc ion binding	Futreal et al 2004,  Mitelman 2000,  Translocation
3932	LCK	lymphocyte-specific protein tyrosine kinase	NM_005356	NP_005347.3	ENSG00000182866	chr1:32512517 - 32523904	ATP binding;ATPase binding;caspase activation;CD4 receptor binding;CD8 receptor binding;glycoprotein binding;hemopoiesis;induction of apoptosis;intracellular signaling cascade;lipid raft;nucleotide binding;pericentriolar material;phosphoinositide 3-kinase binding;plasma membrane;positive regulation of T cell activation;positive regulation of T cell receptor signaling pathway;protein amino acid phosphorylation;protein C-terminus binding;protein kinase binding;protein serine/threonine phosphatase activity;pro	NOTCH,  Futreal et al 2004,  Mitelman 2000,  Protein Kinase,  Tyrosine Kinase,  Entrez Query:Oncogene,  Translocation
3936	LCP1	lymphocyte cytosolic protein 1 (L-plastin)	NM_002298	NP_002289.2	ENSG00000136167	chr13:45599726 - 45631798	actin binding;actin filament;actin filament binding;actin filament bundle formation;biological_process;calcium ion binding;cytoplasm;cytosol;identical protein binding;phagocytic cup;ruffle	Futreal et al 2004,  Mitelman 2000,  Translocation
10186	LHFP	lipoma HMGIC fusion partner	NM_005780	NP_005771.1	ENSG00000183722	chr13:38816072 - 39073353	DNA binding;integral to membrane;membrane	Futreal et al 2004,  Mitelman 2000,  Translocation
3977	LIFR	leukemia inhibitory factor receptor alpha	NM_002310, NM_001127671	NP_002301.1, NP_001121143.1	ENSG00000113594	chr5:38517453 - 38566506	cell surface receptor linked signal transduction;integral to plasma membrane;leukemia inhibitory factor receptor activity;membrane;positive regulation of cell proliferation;protein binding;receptor activity	Futreal et al 2004,  Mitelman 2000,  Stability,  Translocation
4004	LMO1	LIM domain only 1 (rhombotin 1)	NM_002315	NP_002306.1	ENSG00000166407	chr11:8202738 - 8241485	cell proliferation;metal ion binding;multicellular organismal development;nucleus;transcription factor activity;zinc ion binding	Futreal et al 2004,  Mitelman 2000,  Translocation
4005	LMO2	LIM domain only 2 (rhombotin-like 1)	NM_005574	NP_005565.2	ENSG00000135363	chr11:33837477 - 33847508	metal ion binding;multicellular organismal development;nucleus;protein binding;zinc ion binding	Futreal et al 2004,  Mitelman 2000,  Entrez Query:Oncogene,  Translocation
