Entrez ID	Gene Symbol	Gene Name	Refseq mRNA	Refseq Protein	Ensembl Gene ID	UCSC Genomic Coordinates	GO Categories	Sources
4026	LPP	LIM domain containing preferred translocation partner in lipoma	NM_005578	NP_005569.1	ENSG00000145012	chr3:189606602 - 190074961	biological_process;cell adhesion;cellular_component;metal ion binding;molecular_function;nucleus;protein binding;zinc ion binding	Futreal et al 2004,  Mitelman 2000,  Translocation
4066	LYL1	lymphoblastic leukemia derived sequence 1	NM_005583	NP_005574.2	ENSG00000104903	chr19:13071132 - 13072985	DNA binding;nucleus;regulation of transcription, DNA-dependent;transcription regulator activity	Futreal et al 2004,  Mitelman 2000,  Translocation
4094	MAF	v-maf musculoaponeurotic fibrosarcoma oncogene homolog (avian)	NM_001031804, NM_005360	NP_001026974.1, NP_005351.2	ENSG00000178573	chr16:78185857 - 78191300	chromatin;cytokine production;cytoplasm;nucleus;positive regulation of transcription from RNA polymerase II promoter;protein dimerization activity;regulation of transcription, DNA-dependent;RNA polymerase II transcription factor activity;sequence-specific DNA binding;transcription factor activity;transcription from RNA polymerase II promoter	Futreal et al 2004,  Mitelman 2000,  Entrez Query:Oncogene,  Translocation
9935	MAFB	v-maf musculoaponeurotic fibrosarcoma oncogene homolog B (avian)	NM_005461	NP_005452.2	ENSG00000179050	chr20:38749932 - 38750904	inner ear morphogenesis;negative regulation of erythrocyte differentiation;nucleus;positive regulation of transcription from RNA polymerase II promoter;protein dimerization activity;respiratory gaseous exchange;segment specification;sensory organ development;sequence-specific DNA binding;transcription;transcription factor activity;transcription factor binding;transcription factor complex	Futreal et al 2004,  Mitelman 2000,  Entrez Query:Oncogene,  Translocation
10892	MALT1	mucosa associated lymphoid tissue lymphoma translocation gene 1	NM_006785, NM_173844	NP_006776.1, NP_776216.1	ENSG00000172175	chr18:54489855 - 54566054	activation of NF-kappaB-inducing kinase;anti-apoptosis;caspase activity;CBM complex;cytoplasm;defense response;kinase activator activity;nuclear export;nucleus;peptidase activity;positive regulation of I-kappaB kinase/NF-kappaB cascade;positive regulation of T cell activation;positive regulation of T cell cytokine production;protein oligomerization;protein self-association;proteolysis;regulation of apoptosis;signal transducer activity;T cell receptor signaling pathway;ubiquitin cycle;ubiquitin-protein ligas	Futreal et al 2004,  Mitelman 2000,  Translocation
84441	MAML2	mastermind-like 2 (Drosophila)	NM_032427	NP_115803.1	null	chr11:95351759 - 95714707	Notch signaling pathway;nucleus;positive regulation of transcription from RNA polymerase II promoter;regulation of transcription, DNA-dependent;transcription;transcription coactivator activity	NOTCH,  Futreal et al 2004,  Mitelman 2000,  Entrez Query:Oncogene,  Translocation
6416	MAP2K4	mitogen-activated protein kinase kinase 4	NM_003010	NP_003001.1	ENSG00000065559	chr17:11864928 - 11985302	ATP binding;JNK cascade;nucleotide binding;protein amino acid phosphorylation;protein binding;protein serine/threonine kinase activity;protein-tyrosine kinase activity;signal transduction;transferase activity	Futreal et al 2004,  Vogelstein and Kinzler 2004,  Tumor Suppressor,  Large deletion,  Missense mutation,  Nonsense mutation
4197	MDS1	myelodysplasia syndrome 1			null	chr3:null	transcription factor activity	Futreal et al 2004,  Mitelman 2000,  Translocation
4221	MEN1	multiple endocrine neoplasia I	NM_130802, NM_130799	NP_570716.1, NP_570711.1	ENSG00000133895	chr11:64328381 - 64334157	cleavage furrow;cytosol;DNA binding;histone methylation;histone methyltransferase complex;negative regulation of transcription from RNA polymerase II promoter;nucleus;positive regulation of transcription;protein binding;regulation of transcription, DNA-dependent;transcription regulator activity	Futreal et al 2004,  Vogelstein and Kinzler 2004,  Protein Kinase,  Stability,  Tumor Suppressor,  Frameshift mutation,  Large deletion,  Missense mutation,  Nonsense mutation,  Splicing mutation
4233	MET	met proto-oncogene (hepatocyte growth factor receptor)	NM_001127500, NM_000245	NP_001120972.1, NP_000236.2	ENSG00000105976	chr7:116126374 - 116223414	activation of MAPK activity;adult behavior;ATP binding;basal plasma membrane;brain development;cell surface receptor linked signal transduction;hepatocyte growth factor receptor activity;hepatocyte growth factor receptor signaling pathway;integral to plasma membrane;membrane;membrane fraction;multicellular organismal development;muscle development;myoblast proliferation;nucleotide binding;protein amino acid autophosphorylation;protein amino acid phosphorylation;protein binding;protein-tyrosine kinase activi	Alpha6Beta4 Integrin,  Futreal et al 2004,  Vogelstein and Kinzler 2004,  Protein Kinase,  Stability,  Tumor Suppressor,  Tyrosine Kinase,  Entrez Query:Oncogene,  Missense mutation
57591	MKL1	megakaryoblastic leukemia (translocation) 1	NM_020831	NP_065882.1	ENSG00000196588	chr22:39137339 - 39189177	actin binding;anti-apoptosis;cytoplasm;nucleic acid binding;nucleus;positive regulation of transcription;protein binding;regulation of transcription, DNA-dependent;transcription;transcription coactivator activity	Futreal et al 2004,  Mitelman 2000,  Translocation
4291	MLF1	myeloid leukemia factor 1	NM_022443	NP_071888.1	ENSG00000178053	chr3:159771783 - 159805685	cell cycle arrest;cell differentiation;cytoplasm;DNA binding;multicellular organismal development;myeloid progenitor cell differentiation;nucleus;protein binding;protein domain specific binding;transcription	Futreal et al 2004,  Mitelman 2000,  Translocation
4292	MLH1	mutL homolog 1, colon cancer, nonpolyposis type 2 (E. coli)	NM_000249	NP_000240.1	ENSG00000076242	chr3:37010042 - 37067148	ATP binding;cell cycle;guanine/thymine mispair binding;mismatch repair;mismatched DNA binding;MutSalpha complex binding;negative regulation of progression through cell cycle;nucleus;protein binding;single-stranded DNA binding	Futreal et al 2004,  Vogelstein and Kinzler 2004,  Stability,  Tumor Suppressor,  Frameshift mutation,  Large deletion,  Missense mutation,  Nonsense mutation,  Splicing mutation
4297	MLL	myeloid/lymphoid or mixed-lineage leukemia (trithorax homolog, Drosophila)	NM_005933	NP_005924.2	ENSG00000118058	chr11:117812437 - 117898097	anterior/posterior pattern formation;ATP binding;DNA binding;DNA methylation;embryonic hemopoiesis;metal ion binding;nuclear part;protein amino acid phosphorylation;protein binding;protein complex assembly;protein homodimerization activity;protein kinase activity;regulation of histone H3-K4 methylation;regulation of transcription, DNA-dependent;RNA polymerase II transcription factor activity;transcription;transcription factor activity;transcription from RNA polymerase II promoter;zinc ion binding	Futreal et al 2004,  Mitelman 2000,  Vogelstein and Kinzler 2004,  Stability,  Tumor Suppressor,  Entrez Query:Oncogene,  Translocation
4298	MLLT1	myeloid/lymphoid or mixed-lineage leukemia (trithorax homolog, Drosophila); translocated to, 1	NM_005934	NP_005925.2	ENSG00000130382	chr19:6164052 - 6230795	DNA binding;nucleus;regulation of transcription, DNA-dependent;RNA polymerase II transcription factor activity;transcription;transcription from RNA polymerase II promoter	Futreal et al 2004,  Mitelman 2000,  Protein Kinase,  Translocation
8028	MLLT10	myeloid/lymphoid or mixed-lineage leukemia (trithorax homolog, Drosophila); translocated to, 10	NM_001009569, NM_004641	NP_001009569.1, NP_004632.1	ENSG00000078403	chr10:21863579 - 22069169	metal ion binding;nucleus;protein binding;transcription factor activity;zinc ion binding	Futreal et al 2004,  Mitelman 2000,  Translocation
10962	MLLT11	myeloid/lymphoid or mixed-lineage leukemia (trithorax homolog, Drosophila); translocated to, 11	NM_006818	NP_006809.1	ENSG00000143443	chr1:149306324 - 149306597	cellular_component;molecular_function	Futreal et al 2004,  Mitelman 2000,  Translocation
4300	MLLT3	myeloid/lymphoid or mixed-lineage leukemia (trithorax homolog, Drosophila); translocated to, 3	NM_004529	NP_004520.2	ENSG00000171843	chr9:20336440 - 20612255	nucleus;regulation of transcription, DNA-dependent;transcription	Futreal et al 2004,  Mitelman 2000,  Translocation
4301	MLLT4	myeloid/lymphoid or mixed-lineage leukemia (trithorax homolog, Drosophila); translocated to, 4	NM_001040001, NM_001040000, NM_005936	NP_001035090.1, NP_001035089.1, NP_005927.2	ENSG00000130396	chr6:167970661 - 168113464	biological_process;cell adhesion;cell-cell signaling;cellular_component;intercellular junction;molecular_function;protein binding;protein C-terminus binding;signal transduction	Futreal et al 2004,  Mitelman 2000,  Translocation
4302	MLLT6	myeloid/lymphoid or mixed-lineage leukemia (trithorax homolog, Drosophila); translocated to, 6	NM_005937	NP_005928.2	ENSG00000108292	chr17:34115411 - 34135377	metal ion binding;nucleus;protein binding;regulation of transcription, DNA-dependent;zinc ion binding	Futreal et al 2004,  Mitelman 2000,  Translocation
4330	MN1	meningioma (disrupted in balanced translocation) 1	NM_002430	NP_002421.3	null	chr22:26476902 - 26526531	biological_process;cell cycle;cellular_component;molecular_function;negative regulation of progression through cell cycle	Futreal et al 2004,  Mitelman 2000,  Tumor Suppressor,  Entrez Query:Oncogene,  Translocation
3110	MNX1	homeobox HB9	NM_005515	NP_005506.3	ENSG00000130675	chr7:156490974 - 156495805	anatomical structure morphogenesis;humoral immune response;nucleus;regulation of transcription from RNA polymerase II promoter;RNA polymerase II transcription factor activity;sequence-specific DNA binding;transcription factor activity	Futreal et al 2004,  Mitelman 2000,  Translocation
4436	MSH2	mutS homolog 2, colon cancer, nonpolyposis type 1 (E. coli)	NM_000251	NP_000242.1	ENSG00000095002	chr2:47483834 - 47563592	ADP binding;apoptosis;ATP binding;ATPase activity;B cell differentiation;B cell mediated immunity;base-excision repair;cell cycle;cell cycle arrest;cell motility;centromeric DNA binding;damaged DNA binding;determination of adult life span;dinucleotide repeat insertion binding;four-way junction DNA binding;guanine/thymine mispair binding;hypoxanthine phosphoribosyltransferase activity;in utero embryonic development;intra-S DNA damage checkpoint;isotype switching;magnesium ion binding;maintenance of DNA repea	Futreal et al 2004,  Vogelstein and Kinzler 2004,  Stability,  Tumor Suppressor,  Frameshift mutation,  Large deletion,  Missense mutation,  Nonsense mutation,  Splicing mutation
2956	MSH6	mutS homolog 6 (E. coli)	NM_000179	NP_000170.1	ENSG00000116062	chr2:47863876 - 47887503	ADP binding;ATP binding;ATPase activity;base-excision repair;chromatin binding;damaged DNA binding;determination of adult life span;dinucleotide insertion or deletion binding;DNA damage response, signal transduction resulting in induction of apoptosis;four-way junction DNA binding;guanine/thymine mispair binding;isotype switching;magnesium ion binding;mismatch repair;mismatched DNA binding;MutLalpha complex binding;MutSalpha complex;negative regulation of DNA recombination;nuclear chromatin;nucleotide bindi	Futreal et al 2004,  Vogelstein and Kinzler 2004,  Stability,  Frameshift mutation,  Missense mutation,  Nonsense mutation,  Splicing mutation
124540	MSI2	musashi homolog 2 (Drosophila)	NM_138962, NM_170721	NP_620412.1, NP_733839.1	ENSG00000153944	chr17:52689102 - 53109388	nucleotide binding;RNA binding	Futreal et al 2004,  Mitelman 2000,  Translocation
4478	MSN	moesin	NM_002444	NP_002435.1	ENSG00000147065	chrX:64804433 - 64876480	apical plasma membrane;basolateral plasma membrane;cell motility;cytoplasm;cytoskeletal protein binding;cytoskeleton;plasma membrane;receptor binding;structural constituent of cytoskeleton;uropod	Futreal et al 2004,  Translocation
4515	MTCP1	mature T-cell proliferation 1	NM_001018025	NP_001018025.1	ENSG00000182712	chrX:153946958 - 153947479	cell proliferation;mitochondrion;regulation of progression through cell cycle	Futreal et al 2004,  Mitelman 2000,  Translocation
4582	MUC1	mucin 1, cell surface associated	NM_001044393, NM_001018017, NM_001018016, NM_001044392, NM_002456, NM_001044391, NM_001044390	NP_001037858.1, NP_001018017.1, NP_001018016.1, NP_001037857.1, NP_002447.4, NP_001037856.1, NP_001037855.1	ENSG00000185499	chr1:153425234 - 153429258	actin binding;cytoskeleton;extracellular region;hormone activity;integral to plasma membrane;membrane	Futreal et al 2004,  Mitelman 2000,  Stability,  Translocation
4595	MUTYH	mutY homolog (E. coli)	NM_001048172, NM_001128425, NM_001048173, NM_012222	NP_001041637.1, NP_001121897.1, NP_001041639.1, NP_036354.1	ENSG00000132781	chr1:45567564 - 45572764	4 iron, 4 sulfur cluster binding;base-excision repair;cell cycle;DNA binding;DNA N-glycosylase activity;endonuclease activity;hydrolase activity;hydrolase activity, acting on glycosyl bonds;intracellular;iron ion binding;metabolic process;metal ion binding;mismatch repair;MutLalpha complex binding;MutLbeta complex binding;MutSalpha complex binding;MutSbeta complex binding;negative regulation of progression through cell cycle;nucleus;protein binding	Futreal et al 2004,  Vogelstein and Kinzler 2004,  Stability,  Missense mutation
4609	MYC	v-myc myelocytomatosis viral oncogene homolog (avian)	NM_002467	NP_002458.2	ENSG00000136997	chr8:128818021 - 128822386	activation of pro-apoptotic gene products;caspase activation;cell cycle arrest;DNA binding;DNA fragmentation during apoptosis;induction of apoptosis by intracellular signals;iron ion homeostasis;negative regulation of survival gene product activity;nucleus;positive regulation of cell proliferation;protein binding;regulation of apoptosis;regulation of transcription from RNA polymerase II promoter;regulation of transcription, DNA-dependent;release of cytochrome c from mitochondria;response to radiation;spindl	EGFR1,  TGFBR,  Futreal et al 2004,  Hahn and Weinberg 2002,  Mitelman 2000,  Vogelstein and Kinzler 2004,  Stability,  Tumor Suppressor,  Entrez Query:Oncogene,  Amplification,  Translocation
4610	MYCL1	v-myc myelocytomatosis viral oncogene homolog 1, lung carcinoma derived (avian)	NM_001033081, NM_005376	NP_001028254.1, NP_005367.1	ENSG00000116990	chr1:40135630 - 40139693	nucleus;regulation of transcription, DNA-dependent;transcription factor activity	Futreal et al 2004,  Vogelstein and Kinzler 2004,  Entrez Query:Oncogene,  Amplification
4613	MYCN	v-myc myelocytomatosis viral related oncogene, neuroblastoma derived (avian)	NM_005378	NP_005369.2	ENSG00000134323	chr2:15999637 - 16003670	branching morphogenesis of a tube;chromatin;lung development;nucleus;positive regulation of cell proliferation;protein binding;regulation of transcription from RNA polymerase II promoter;transcription factor activity	Futreal et al 2004,  Vogelstein and Kinzler 2004,  Stability,  Tumor Suppressor,  Entrez Query:Oncogene,  Amplification
4629	MYH11	myosin, heavy chain 11, smooth muscle	NM_001040113, NM_001040114, NM_002474, NM_022844	NP_001035202.1, NP_001035203.1, NP_002465.1, NP_074035.1	ENSG00000133392	chr16:15705348 - 15839610	actin binding;ATP binding;calmodulin binding;elastic fiber assembly;motor activity;muscle thick filament assembly;myosin complex;nucleotide binding;smooth muscle contraction;smooth muscle fiber development;striated muscle contraction;striated muscle thick filament;structural constituent of muscle	Futreal et al 2004,  Mitelman 2000,  Translocation
4627	MYH9	myosin, heavy chain 9, non-muscle	NM_002473	NP_002464.1	ENSG00000100345	chr22:35008659 - 35075227	actin cytoskeleton reorganization;actin filament binding;actin filament-based movement;angiogenesis;ATP binding;ATPase activity;blood vessel endothelial cell migration;calmodulin binding;cleavage furrow;contractile ring;cytokinesis;cytoplasm;cytosol;integrin complex;integrin-mediated signaling pathway;leukocyte migration;membrane protein ectodomain proteolysis;microfilament motor activity;monocyte differentiation;motor activity;myosin complex;nucleotide binding;nucleus;plasma membrane;platelet formation;pro	Futreal et al 2004,  Stability,  Translocation
23522	MYST4	MYST histone acetyltransferase (monocytic leukemia) 4	NM_012330	NP_036462.2	ENSG00000156650	chr10:76272621 - 76460810	acetyltransferase activity;chromatin modification;DNA binding;histone acetylation;histone acetyltransferase activity;metal ion binding;negative regulation of transcription;nucleosome;nucleosome assembly;nucleus;positive regulation of transcription;regulation of transcription, DNA-dependent;transcription;transcription factor binding;transcriptional activator activity;transcriptional repressor activity;transferase activity;zinc ion binding	Futreal et al 2004,  Mitelman 2000,  Translocation
4666	NACA	nascent polypeptide-associated complex alpha subunit	NM_001113201, NM_001113202, NM_001113203, NM_005594	NP_001106672.1, NP_001106673.1, NP_001106674.1, NP_005585.1	ENSG00000196531	chr12:55392588 - 55404572	cytoplasm;DNA binding;nascent polypeptide-associated complex;nucleus;protein transport;transcription;translation	Futreal et al 2004,  Translocation
4683	NBN	nibrin			ENSG00000104320	chr8:null	blastocyst growth;cell cycle;cell cycle arrest;cell proliferation;chromosome;chromosome, telomeric region;damaged DNA binding;DNA damage checkpoint;DNA damage response, signal transduction by p53 class mediator;double-strand break repair;G1/S transition checkpoint;in utero embryonic development;intracellular;isotype switching;meiosis;mitotic G2 checkpoint;Mre11 complex;nuclear inclusion body;nucleus;protein N-terminus binding;regulation of balance;regulation of DNA replication initiation;replication fork;te	Futreal et al 2004,  Vogelstein and Kinzler 2004,  Stability,  Tumor Suppressor,  Frameshift mutation,  Missense mutation,  Nonsense mutation
51517	NCKIPSD	NCK interacting protein with SH3 domain	NM_016453, NM_184231	NP_057537.1, NP_909119.1	ENSG00000162198	chr3:48686980 - 48698244	axonal fasciculation;cytoskeletal protein binding;cytoskeleton organization and biogenesis;intermediate filament;NLS-bearing substrate import into nucleus;nucleus;signal transduction	Futreal et al 2004,  Translocation
10499	NCOA2	nuclear receptor coactivator 2	NM_006540	NP_006531.1	ENSG00000140396	chr8:71188420 - 71291534	nucleus;protein binding;regulation of transcription, DNA-dependent;signal transducer activity;signal transduction;transcription coactivator activity;transcription regulator activity	Androgen Receptor,  Futreal et al 2004,  Mitelman 2000,  Translocation
8031	NCOA4	nuclear receptor coactivator 4	NM_005437	NP_005428.1	ENSG00000138293	chr10:51249147 - 51259236	androgen receptor binding;androgen receptor signaling pathway;male gonad development;nucleus;positive regulation of transcription, DNA-dependent;protein binding;receptor activity;transcription;transcription coactivator activity;transmembrane receptor protein tyrosine kinase signaling pathway	Androgen Receptor,  Futreal et al 2004,  Mitelman 2000,  Entrez Query:Oncogene,  Translocation
4763	NF1	neurofibromin 1 (neurofibromatosis, von Recklinghausen disease, Watson disease)	NM_000267, NM_001042492, NM_001128147	NP_000258.1, NP_001035957.1, NP_001121619.1	ENSG00000196712	chr17:26446453 - 26725299	adrenal gland development;biological_process;cell cycle;cellular_component;cytoplasm;enzyme inhibitor activity;GTPase activator activity;heart development;intracellular;molecular_function;negative regulation of cell migration;negative regulation of endothelial cell proliferation;negative regulation of MAPKKK cascade;negative regulation of progression through cell cycle;positive regulation of Ras GTPase activity;protein binding;Ras GTPase activator activity;Ras protein signal transduction;regulation of glial	Futreal et al 2004,  Hahn and Weinberg 2002,  Vogelstein and Kinzler 2004,  Tumor Suppressor,  Frameshift mutation,  Large deletion,  Missense mutation,  Nonsense mutation,  Splicing mutation
4771	NF2	neurofibromin 2 (bilateral acoustic neuroma)	NM_181832, NM_000268, NM_181828, NM_181829, NM_181833, NM_181830	NP_861970.1, NP_000259.1, NP_861966.1, NP_861967.1, NP_861971.1, NP_861969.1	ENSG00000186575	chr22:28329987 - 28420791	cell cycle;cytoplasm;cytoskeletal protein binding;cytoskeleton;negative regulation of cell proliferation;negative regulation of progression through cell cycle;nucleus;plasma membrane;sensory perception of sound;structural molecule activity	Futreal et al 2004,  Hahn and Weinberg 2002,  Vogelstein and Kinzler 2004,  Protein Kinase,  Tumor Suppressor,  Frameshift mutation,  Large deletion,  Missense mutation,  Nonsense mutation,  Splicing mutation
4791	NFKB2	nuclear factor of kappa light polypeptide gene enhancer in B-cells 2 (p49/p100)	NM_002502, NM_001077494	NP_002493.3, NP_001070962.1	ENSG00000077150	chr10:104145706 - 104152123	cytoplasm;extracellular matrix organization and biogenesis;follicular dendritic cell differentiation;germinal center formation;nucleus;protein binding;regulation of transcription, DNA-dependent;signal transduction;spleen development;transcription coactivator activity;transcription factor activity	TNF_alpha_NF_kB,  Futreal et al 2004,  Mitelman 2000,  Tumor Suppressor,  Entrez Query:Oncogene,  Translocation
51199	NIN	ninein (GSK3B interacting protein)	NM_182944, NM_182946, NM_020921, NM_016350	NP_891989.2, NP_891991.1, NP_065972.3, NP_057434.3	ENSG00000100503	chr14:50259930 - 50358524	calcium ion binding;centrosome;centrosome localization;GTP binding;microtubule;nucleotide binding;protein binding	Futreal et al 2004,  Translocation
4841	NONO	non-POU domain containing, octamer-binding	NM_007363	NP_031389.3	ENSG00000147140	chrX:70427212 - 70436651	DNA binding;DNA recombination;DNA repair;mRNA processing;nucleotide binding;nucleus;protein binding;regulation of transcription, DNA-dependent;RNA binding;RNA splicing;transcription	Futreal et al 2004,  Mitelman 2000,  Stability,  Translocation
4851	NOTCH1	Notch homolog 1, translocation-associated (Drosophila)	NM_017617	NP_060087.3	null	chr9:138510343 - 138560059	calcium ion binding;cell differentiation;immune response;integral to membrane;membrane;multicellular organismal development;negative regulation of myoblast differentiation;Notch signaling pathway;nucleus;protein binding;receptor activity;regulation of developmental process;regulation of transcription, DNA-dependent	NOTCH,  Futreal et al 2004,  Mitelman 2000,  Vogelstein and Kinzler 2004,  Stability,  Tumor Suppressor,  Missense mutation,  Translocation
4869	NPM1	nucleophosmin (nucleolar phosphoprotein B23, numatrin)	NM_002520, NM_001037738, NM_199185	NP_002511.1, NP_001032827.1, NP_954654.1	ENSG00000181163	chr5:170747557 - 170770174	activation of NF-kappaB transcription factor;anti-apoptosis;cell aging;centrosome;centrosome cycle;cytoplasm;intracellular protein transport;negative regulation of cell proliferation;NF-kappaB binding;nucleocytoplasmic transport;nucleolus;nucleus;protein heterodimerization activity;protein homodimerization activity;response to stress;ribosome assembly;RNA binding;signal transduction;Tat protein binding;transcription coactivator activity;unfolded protein binding	Futreal et al 2004,  Mitelman 2000,  Stability,  Tumor Suppressor,  Entrez Query:Oncogene,  Translocation
8013	NR4A3	nuclear receptor subfamily 4, group A, member 3	NM_173199, NM_173198	NP_775291.1, NP_775290.1	ENSG00000119508	chr9:101628873 - 101665970	binding;biological_process;ligand-dependent nuclear receptor activity;mesoderm formation;metal ion binding;nucleus;regulation of transcription, DNA-dependent;sequence-specific DNA binding;steroid hormone receptor activity;thyroid hormone receptor activity;transcription;transcription factor activity;zinc ion binding	Futreal et al 2004,  Mitelman 2000,  Tumor Suppressor,  Translocation
4893	NRAS	neuroblastoma RAS viral (v-ras) oncogene homolog	NM_002524	NP_002515.1	ENSG00000168638	chr1:115052678 - 115060304	GTP binding;GTPase activity;intracellular;membrane;nucleotide binding;regulation of progression through cell cycle;small GTPase mediated signal transduction	EGFR1,  Futreal et al 2004,  Hahn and Weinberg 2002,  Entrez Query:Oncogene,  Missense mutation
64324	NSD1	nuclear receptor binding SET domain protein 1	NM_172349, NM_022455	NP_758859.1, NP_071900.2	ENSG00000165671	chr5:176494710 - 176655066	androgen receptor binding;chromatin binding;chromatin modification;estrogen receptor binding;histone lysine N-methyltransferase activity (H3-K36 specific);histone lysine N-methyltransferase activity (H4-K20 specific);histone methylation;histone methyltransferase complex;ligand-dependent nuclear receptor binding;metal ion binding;methyltransferase activity;negative regulation of transcription from RNA polymerase II promoter;nucleus;positive regulation of transcription, DNA-dependent;protein binding;retinoid 	Androgen Receptor,  Futreal et al 2004,  Mitelman 2000,  Translocation
4914	NTRK1	neurotrophic tyrosine kinase, receptor, type 1	NM_001012331, NM_002529, NM_001007792	NP_001012331.1, NP_002520.2, NP_001007793.1	ENSG00000198400	chr1:155097350 - 155118058	ATP binding;B cell differentiation;biological_process;cellular_component;cytoplasm;integral to membrane;integral to plasma membrane;kinase activity;mechanoreceptor differentiation;membrane;multicellular organismal development;nervous system development;neurotrophin binding;nucleotide binding;protein amino acid phosphorylation;protein binding;receptor activity;transferase activity;transmembrane receptor protein tyrosine kinase activity;transmembrane receptor protein tyrosine kinase signaling pathway	Futreal et al 2004,  Mitelman 2000,  Vogelstein and Kinzler 2004,  Protein Kinase,  Tumor Suppressor,  Tyrosine Kinase,  Entrez Query:Oncogene,  Translocation
