Entrez ID	Gene Symbol	Gene Name	Refseq mRNA	Refseq Protein	Ensembl Gene ID	UCSC Genomic Coordinates	GO Categories	Sources
5970	RELA	v-rel reticuloendotheliosis viral oncogene homolog A, nuclear factor of kappa light polypeptide gene enhancer in B-cells 3, p65 (avian)	NM_021975	NP_068810.3	ENSG00000173039	chr11:65178424 - 65186879	activation of NF-kappaB transcription factor;anti-apoptosis;cellular defense response;cytokine and chemokine mediated signaling pathway;cytoplasm;defense response to virus;hair follicle development;identical protein binding;inflammatory response;negative regulation of protein catabolic process;NF-kappaB binding;nucleus;organ morphogenesis;phosphate binding;positive regulation of I-kappaB kinase/NF-kappaB cascade;positive regulation of interleukin-12 biosynthetic process;positive regulation of transcription,	Androgen Receptor,  NOTCH,  TNF_alpha_NF_kB,  Protein Kinase,  Stability,  Tumor Suppressor,  Entrez Query:Oncogene
6015	RING1	ring finger protein 1	NM_002931	NP_002922.2	ENSG00000112477	chr6:33284577 - 33288154	chromatin modification;ligase activity;metal ion binding;nucleus;protein binding;regulation of transcription, DNA-dependent;transcription;transcriptional repressor activity;ubiquitin cycle;zinc ion binding	NOTCH
8819	SAP30	Sin3A-associated protein, 30kDa	NM_003864	NP_003855.1	ENSG00000164105	chr4:174528908 - 174535053	histone deacetylase complex;nucleus;protein binding;regulation of transcription, DNA-dependent;transcription;transcription corepressor activity	NOTCH
25942	SIN3A	SIN3 homolog A, transcription regulator (yeast)	NM_015477	NP_056292.1	ENSG00000169375	chr15:73451372 - 73509769	negative regulation of transcription, DNA-dependent;nucleus;protein binding;transcription	Androgen Receptor,  EGFR1,  Hedgehog,  NOTCH
6500	SKP1	S-phase kinase-associated protein 1A (p19A)	NM_170679, NM_006930	NP_733779.1, NP_008861.2	ENSG00000113558	chr5:133521322 - 133537612	biological_process;cellular_component;molecular_function;protein binding;ubiquitin cycle	NOTCH,  TGFBR,  TNF_alpha_NF_kB,  Wnt
6502	SKP2	S-phase kinase-associated protein 2 (p45)	NM_005983, NM_032637	NP_005974.2, NP_116026.1	ENSG00000145604	chr5:36188121 - 36217890	cell proliferation;G1/S transition of mitotic cell cycle;protein binding;regulation of progression through cell cycle;ubiquitin cycle	NOTCH,  Stability
4088	SMAD3	SMAD family member 3	NM_005902	NP_005893.1	ENSG00000166949	chr15:65145546 - 65269928	double-stranded DNA binding;intracellular;mesoderm formation;negative regulation of transcription from RNA polymerase II promoter;nucleus;paraxial mesoderm morphogenesis;plasma membrane;positive regulation of transcription from RNA polymerase II promoter;regulation of binding;regulation of epithelial cell proliferation;regulation of immune response;regulation of striated muscle development;regulation of transforming growth factor beta receptor signaling pathway;T cell activation;transcription;transcription 	Alpha6Beta4 Integrin,  Androgen Receptor,  EGFR1,  ID,  NOTCH,  TGFBR,  Wnt,  Protein Kinase,  Stability,  Tumor Suppressor
4089	SMAD4	SMAD family member 4	NM_005359	NP_005350.1	ENSG00000141646	chr18:46827414 - 46858835	anterior/posterior pattern formation;cytoplasm;gastrulation (sensu Mammalia);intracellular;kidney development;negative regulation of cell proliferation;nucleus;positive regulation of transcription from RNA polymerase II promoter;protein binding;regulation of binding;SMAD protein complex assembly;transcription;transcription cofactor activity;transcription factor activity;transcription factor complex;transcriptional activator activity;ureteric bud branching	Androgen Receptor,  NOTCH,  TGFBR,  Wnt,  Futreal et al 2004,  Vogelstein and Kinzler 2004,  Stability,  Tumor Suppressor,  Frameshift mutation,  Large deletion,  Missense mutation,  Nonsense mutation
22938	SNW1	SNW domain containing 1	NM_012245	NP_036377.1	ENSG00000100603	chr14:77254183 - 77297223	GTP binding;negative regulation of transcription;Notch binding;nuclear mRNA splicing, via spliceosome;nucleus;protein binding;regulation of transcription from RNA polymerase II promoter;RNA binding;RNA splicing;signal recognition particle, endoplasmic reticulum targeting;spliceosome;SRP-dependent cotranslational protein targeting to membrane;transcription coactivator activity	NOTCH,  TGFBR
23013	SPEN	spen homolog, transcriptional regulator (Drosophila)	NM_015001	NP_055816.2	ENSG00000065526	chr1:16047149 - 16138509	DNA binding;Notch signaling pathway;nucleic acid binding;nucleotide binding;nucleus;regulation of transcription, DNA-dependent;RNA binding	NOTCH
6774	STAT3	signal transducer and activator of transcription 3 (acute-phase response factor)	NM_213662, NM_139276, NM_003150	NP_998827.1, NP_644805.1, NP_003141.2	ENSG00000168610	chr17:37721288 - 37754060	acute-phase response;calcium ion binding;cell motility;cytokine and chemokine mediated signaling pathway;cytoplasm;hematopoietin/interferon-class (D200-domain) cytokine receptor signal transducer activity;intracellular signaling cascade;JAK-STAT cascade;negative regulation of transcription from RNA polymerase II promoter;nervous system development;nucleus;signal transducer activity;transcription factor activity;transcription factor binding	Androgen Receptor,  EGFR1,  NOTCH,  Protein Kinase,  Stability,  Tumor Suppressor,  Entrez Query:Oncogene
6929	TCF3	transcription factor 3 (E2A immunoglobulin enhancer binding factors E12/E47)	NM_003200	NP_003191.1	ENSG00000071564	chr19:1562705 - 1601247	B cell lineage commitment;nucleus;positive regulation of transcription, DNA-dependent;protein binding;protein heterodimerization activity;protein homodimerization activity;regulation of transcription;transcription factor activity;transcription regulator activity	ID,  NOTCH,  Wnt,  Futreal et al 2004,  Mitelman 2000,  Tumor Suppressor,  Translocation
7088	TLE1	transducin-like enhancer of split 1 (E(sp1) homolog, Drosophila)	NM_005077	NP_005068.2	ENSG00000196781	chr9:83388932 - 83492975	multicellular organismal development;negative regulation of transcription;negative regulation of Wnt receptor signaling pathway;nucleus;organ morphogenesis;regulation of transcription, DNA-dependent;signal transduction;transcription factor binding;Wnt receptor signaling pathway	NOTCH
55759	WDR12	WD repeat domain 12	NM_018256	NP_060726.3	ENSG00000138442	chr2:203453827 - 203484444	nucleus	NOTCH,  Stability
7528	YY1	YY1 transcription factor	NM_003403	NP_003394.1	ENSG00000100811	chr14:99775334 - 99813690	anterior/posterior pattern formation;intracellular;metal ion binding;nucleus;PcG protein complex;protein binding;regulation of transcription from RNA polymerase II promoter;transcription;transcription coactivator activity;transcription corepressor activity;transcription factor activity;transcription factor complex;zinc ion binding	NOTCH,  Stability
